V. CODEBOOK FOR THE FY 2017 SNAP QC DATABASE                          MATHEMATICA POLICY RESEARCH,V. CODEBOOK FO,R THE FY 2017 SNAP QC DATABASE                          MATHEMATICA POLICY RESEARCH
,,
,,
,,
VARIABLE              ORIGIN* DESCRIPTION                            Quick-Reference Codebook,VARIABLE,ORIGIN* DESCRIPTION                            Quick-Reference Codebook
,,
NOTE: Detailed information on each variable in the database can be found starting on page 59.,NOTE: Detailed,information on each variable in the database can be found starting on page 59.
Unit QC review administrative data,Unit QC review,administrative data
ACTNTYPE                  R       Type of action,ACTNTYPE,R       Type of action
ALLADJ                    R       Allotment adjustment,ALLADJ,R       Allotment adjustment
AMTADJ                    R       Amount of allotment adjustment,AMTADJ,R       Amount of allotment adjustment
AUTHREP                   R       Authorized representative,AUTHREP,R       Authorized representative
BENFIX                    C       Benefit allotment (SNAP benefit) adjusted for errors,BENFIX,C       Benefit allotment (SNAP benefit) adjusted for errors
CASE                      R       Case classification,CASE,R       Case classification
CAT_ELIG                  C       Indicator of categorical eligibility status,CAT_ELIG,C       Indicator of categorical eligibility status
CERTMTH                   R       Months in certification period,CERTMTH,R       Months in certification period
EXPEDSER                  R       Received expedited service,EXPEDSER,R       Received expedited service
HHLDNO                    C       SNAP household identification number,HHLDNO,C       SNAP household identification number
LASTCERT                  C       Months since last SNAP certification,LASTCERT,C       Months since last SNAP certification
LOCALCOD                  R       Local agency code (not retained on public use file),LOCALCOD,R       Local agency code (not retained on public use file)
MED_DED_DEMO              C       Indicator of standard medical deduction demonstration,MED_DED_DEMO,C       Indicator of standard medical deduction demonstration
participation,participation,
MN_FIP                    C       Indicator of MFIP participation,MN_FIP,C       Indicator of MFIP participation
PURE_PA                   C       Indicator of pure cash public assistance status,PURE_PA,C       Indicator of pure cash public assistance status
RCNTACTN                  R       Most recent action on case,RCNTACTN,R       Most recent action on case
REP_SYS                   R       Reporting requirement,REP_SYS,R       Reporting requirement
REVNUM                    R       State QC review number (not retained on public use file),REVNUM,R       State QC review number (not retained on public use file)
SSI_CAP                   C       Indicator of SSI-CAP participation,SSI_CAP,C       Indicator of SSI-CAP participation
STATUS                    R       Status of case error findings,STATUS,R       Status of case error findings
YRMONTH                   R       Sample year and month,YRMONTH,R       Sample year and month
Unit demographics and sample weights,Unit demograph,ics and sample weights
AK_AREA                   C        Alaska region (not retained on public use file),AK_AREA,C        Alaska region (not retained on public use file)
CERTHHSZ                  R        Certified unit size,CERTHHSZ,R        Certified unit size
COMPOSITION               C        Unit composition,COMPOSITION,C        Unit composition
COUNTYCD                  C        FIPS code for county (not retained on public use file),COUNTYCD,C        FIPS code for county (not retained on public use file)
CTPRHH                    C        Number of people in household,CTPRHH,C        Number of people in household
FSDIS                     C        Indicator of non-elderly individuals with disabilities in unit,FSDIS,C        Indicator of non-elderly individuals with disabilities in unit
FSELDER                   C        Indicator of elderly individuals in unit,FSELDER,C        Indicator of elderly individuals in unit
FSKID                     C        Indicator of children in unit,FSKID,C        Indicator of children in unit
FSNDIS                    C        Number of non-elderly individuals with disabilities in unit,FSNDIS,C        Number of non-elderly individuals with disabilities in unit
FSNDISCA                  C        Number of adults age 18 to 49 without disabilities in childless,FSNDISCA,C        Number of adults age 18 to 49 without disabilities in childless
units,units,
FSNELDER                   C       Number of elderly individuals in unit,FSNELDER,C       Number of elderly individuals in unit
FSNGMOM                    C       Indicator of single-female-headed unit,FSNGMOM,C       Indicator of single-female-headed unit
FSNK0T4                    C       Number of preschool-age children in unit,FSNK0T4,C       Number of preschool-age children in unit
FSNK5T17                   C       Number of school-age children in unit,FSNK5T17,C       Number of school-age children in unit
FSNKID                     C       Number of children in unit,FSNKID,C       Number of children in unit
FSNONCIT                   C       Number of noncitizens in unit,FSNONCIT,C       Number of noncitizens in unit
*R indicates the variable is from the raw data; C indicates the variable was constructed.,*R indicates t,he variable is from the raw data; C indicates the variable was constructed.
,,
,,
54,54,
V. CODEBOOK FOR THE FY 2017 SNAP QC DATABASE                          MATHEMATICA POLICY RESEARCH,V. CODEBOOK F,OR THE FY 2017 SNAP QC DATABASE                          MATHEMATICA POLICY RESEARCH
,,
,,
,,
VARIABLE              ORIGIN* DESCRIPTION                            Quick-Reference Codebook,VARIABLE,ORIGIN* DESCRIPTION                            Quick-Reference Codebook
,,
FSUSIZE                   C       Constructed certified unit size,FSUSIZE,C       Constructed certified unit size
FYWGT                     C       Weight used for full-year calculations,FYWGT,C       Weight used for full-year calculations
HWGT                      C       Monthly sample weight,HWGT,C       Monthly sample weight
NONCIT_HEAD               C       Unit head citizenship indicator,NONCIT_HEAD,C       Unit head citizenship indicator
RAWHSIZE                  R       Reported number of people in household,RAWHSIZE,R       Reported number of people in household
REGION                    C       Constructed census region code,REGION,C       Constructed census region code
REGIONCD                  R       FNS region code,REGIONCD,R       FNS region code
STATE                     R       FIPS code for State or territory,STATE,R       FIPS code for State or territory
STATENAME                 C       State or territory,STATENAME,C       State or territory
STRATUM                   R       Stratum identification,STRATUM,R       Stratum identification
TANF_IND                  C       Indicator of TANF receipt for unit,TANF_IND,C       Indicator of TANF receipt for unit
TPOV                      C       Gross income/poverty level ratio,TPOV,C       Gross income/poverty level ratio
URBRUR                    C       Urban/rural indicator (not retained on public use file),URBRUR,C       Urban/rural indicator (not retained on public use file)
WRK_POOR                  C       Indicator of working poor unit,WRK_POOR,C       Indicator of working poor unit
,,
,,
Unit countable income (monthly dollar amounts),Unit countable,income (monthly dollar amounts)
FSCONT                    C       Countable unit income from contributions,FSCONT,C       Countable unit income from contributions
FSCSUPRT                  C       Countable unit child support payment income,FSCSUPRT,C       Countable unit child support payment income
FSDEEM                    C       Countable unit deemed income,FSDEEM,C       Countable unit deemed income
FSDIVER                   C       Countable unit State diversion payments,FSDIVER,C       Countable unit State diversion payments
FSEARN                    C       Countable unit earned income,FSEARN,C       Countable unit earned income
FSEDLOAN                  C       Countable unit income from educational grants and loans,FSEDLOAN,C       Countable unit income from educational grants and loans
FSEITC                    C       Countable unit income from earned income tax credit,FSEITC,C       Countable unit income from earned income tax credit
FSENERGY                  C       Countable unit energy assistance income,FSENERGY,C       Countable unit energy assistance income
FSFOSTER                  C       Countable unit foster care income,FSFOSTER,C       Countable unit foster care income
FSGA                      C       Countable unit general assistance benefits,FSGA,C       Countable unit general assistance benefits
FSGRINC                   C       Final gross countable unit income,FSGRINC,C       Final gross countable unit income
FSNETINC                  C       Final net countable unit income,FSNETINC,C       Final net countable unit income
FSOTHERN                  C       Countable unit other earned income,FSOTHERN,C       Countable unit other earned income
FSOTHGOV                  C       Countable unit income from other government benefits,FSOTHGOV,C       Countable unit income from other government benefits
FSOTHUN                   C       Countable unit other unearned income,FSOTHUN,C       Countable unit other unearned income
FSSLFEMP                  C       Countable unit self-employment income,FSSLFEMP,C       Countable unit self-employment income
FSSOCSEC                  C       Countable unit Social Security income,FSSOCSEC,C       Countable unit Social Security income
FSSSI                     C       Countable unit SSI benefits,FSSSI,C       Countable unit SSI benefits
FSTANF                    C       Countable unit TANF payments,FSTANF,C       Countable unit TANF payments
FSUNEARN                  C       Countable unit unearned income,FSUNEARN,C       Countable unit unearned income
FSUNEMP                   C       Countable unit unemployment compensation benefits,FSUNEMP,C       Countable unit unemployment compensation benefits
FSVET                     C       Countable unit veterans’ benefits,FSVET,C       Countable unit veterans’ benefits
FSWAGES                   C       Countable unit wages and salaries,FSWAGES,C       Countable unit wages and salaries
FSWCOMP                   C       Countable unit workers’ compensation benefits,FSWCOMP,C       Countable unit workers’ compensation benefits
FSWGESUP                  C       Countable unit wage supplementation income,FSWGESUP,C       Countable unit wage supplementation income
RAWGROSS                  R       Reported gross countable unit income,RAWGROSS,R       Reported gross countable unit income
RAWNET                    R       Reported net countable unit income,RAWNET,R       Reported net countable unit income
,,
,,
,,
55,55,
V. CODEBOOK FOR THE FY 2017 SNAP QC DATABASE                        MATHEMATICA POLICY RESEARCH,V. CODEBOOK F,OR THE FY 2017 SNAP QC DATABASE                        MATHEMATICA POLICY RESEARCH
,,
,,
,,
VARIABLE              ORIGIN* DESCRIPTION                          Quick-Reference Codebook,VARIABLE,ORIGIN* DESCRIPTION                          Quick-Reference Codebook
,,
Unit countable and reported assets,Unit countable,and reported assets
FSASSET                   C       Total countable assets under State rules,FSASSET,C       Total countable assets under State rules
FSVEHAST                  C       Countable non-excluded vehicles’ value under State rules,FSVEHAST,C       Countable non-excluded vehicles’ value under State rules
LIQRESOR                  C       Countable liquid assets under State rules,LIQRESOR,C       Countable liquid assets under State rules
OTHNLRES                  C       Countable other nonliquid assets under State rules,OTHNLRES,C       Countable other nonliquid assets under State rules
RAWLQRES                  R       Reported liquid assets,RAWLQRES,R       Reported liquid assets
RAWOTRES                  R       Reported other nonliquid assets,RAWOTRES,R       Reported other nonliquid assets
RAWRPROP                  R       Reported real property,RAWRPROP,R       Reported real property
RAWVHAST                  R       Reported non-excluded vehicles’ value,RAWVHAST,R       Reported non-excluded vehicles’ value
REALPROP                  C       Countable real property under State rules,REALPROP,C       Countable real property under State rules
VEHICLEA                  R       Reported category for first vehicle,VEHICLEA,R       Reported category for first vehicle
VEHICLEB                  R       Reported category for second vehicle,VEHICLEB,R       Reported category for second vehicle
,,
Unit expenses and deductions,Unit expenses,and deductions
ERN_INC_DED_PCT           C       Percentage used to calculate earned income deduction,ERN_INC_DED_PC,T           C       Percentage used to calculate earned income deduction
EXCL_FSCSDED              C       Child support excluded from gross income,EXCL_FSCSDED,C       Child support excluded from gross income
FSCSDED                   C       Child support payment deduction,FSCSDED,C       Child support payment deduction
FSCSEXP                   R       Reported child support payment deduction,FSCSEXP,R       Reported child support payment deduction
FSDEPDED                  R       Reported dependent care deduction,FSDEPDED,R       Reported dependent care deduction
FSDEPDE2                  C       Marginal effectiveness of dependent care deduction,FSDEPDE2,C       Marginal effectiveness of dependent care deduction
FSERNDED                  C       Calculated earned income deduction,FSERNDED,C       Calculated earned income deduction
FSERNDE2                  C       Marginal effectiveness of earned income deduction,FSERNDE2,C       Marginal effectiveness of earned income deduction
FSMEDDED                  C       Calculated medical expense deduction,FSMEDDED,C       Calculated medical expense deduction
FSMEDDE2                  C       Marginal effectiveness of medical expense deduction,FSMEDDE2,C       Marginal effectiveness of medical expense deduction
FSMEDEXP                  R       Reported medical expenses,FSMEDEXP,R       Reported medical expenses
FSSLTDED                  C       Calculated excess shelter expense deduction,FSSLTDED,C       Calculated excess shelter expense deduction
FSSLTDE2                  C       Marginal effectiveness of excess shelter expense deduction,FSSLTDE2,C       Marginal effectiveness of excess shelter expense deduction
FSSLTEXP                  C       Calculated shelter expenses,FSSLTEXP,C       Calculated shelter expenses
FSSTDDED                  C       Standard deduction,FSSTDDED,C       Standard deduction
FSSTDDE2                  C       Marginal effectiveness of standard deduction,FSSTDDE2,C       Marginal effectiveness of standard deduction
FSTOTDED                  C       Total deductions,FSTOTDED,C       Total deductions
FSTOTDE2                  C       Marginal effectiveness of total deduction,FSTOTDE2,C       Marginal effectiveness of total deduction
HOMEDED                   R       Indicator of homelessness,HOMEDED,R       Indicator of homelessness
HOMELESS_DED              C       Amount of homeless household shelter deduction,HOMELESS_DED,C       Amount of homeless household shelter deduction
RAWERND                   R       Reported earned income deduction,RAWERND,R       Reported earned income deduction
RENT                      R       Rent/mortgage amount,RENT,R       Rent/mortgage amount
SHELCAP                   C       Maximum allowable shelter expense deduction,SHELCAP,C       Maximum allowable shelter expense deduction
SHELDED                   R       Reported shelter deduction,SHELDED,R       Reported shelter deduction
SUA1                      R       Standard utility allowance – usage and entitlement,SUA1,R       Standard utility allowance – usage and entitlement
SUA2                      R       Standard utility allowance – prorated,SUA2,R       Standard utility allowance – prorated
UTIL                      R       Utility amount,UTIL,R       Utility amount
,,
,,
,,
,,
56,56,
V. CODEBOOK FOR THE FY 2017 SNAP QC DATABASE                          MATHEMATICA POLICY RESEARCH,V. CODEBOOK F,OR THE FY 2017 SNAP QC DATABASE                          MATHEMATICA POLICY RESEARCH
,,
,,
,,
VARIABLE              ORIGIN* DESCRIPTION                             Quick-Reference Codebook,VARIABLE,ORIGIN* DESCRIPTION                             Quick-Reference Codebook
,,
Unit benefits,Unit benefits,
AMTERR                    R       Amount of benefit in error,AMTERR,R       Amount of benefit in error
ASSLIM                    C       Asset limit,ASSLIM,C       Asset limit
BENMAX                    C       Maximum benefit amount,BENMAX,C       Maximum benefit amount
FSASTEST                  C       Indicator of passing asset test,FSASTEST,C       Indicator of passing asset test
FSBEN                     C       Final calculated benefit,FSBEN,C       Final calculated benefit
FSGRTEST                  C       Indicator of passing gross income test,FSGRTEST,C       Indicator of passing gross income test
FSMINBEN                  C       Received minimum benefit,FSMINBEN,C       Received minimum benefit
FSNETEST                  C       Indicator of passing net income test,FSNETEST,C       Indicator of passing net income test
GROSSCRN                  C       Gross income screen,GROSSCRN,C       Gross income screen
MINIMUM_BEN               C       Minimum benefit amount,MINIMUM_BEN,C       Minimum benefit amount
NETSCRN                   C       Net income screen,NETSCRN,C       Net income screen
RAWBEN                    R       Reported SNAP benefit received,RAWBEN,R       Reported SNAP benefit received
,,
Person-level characteristics: i = 1 to 16,Person-level c,haracteristics: i = 1 to 16
ABWDSTi                   R       ABAWD status,ABWDSTi,R       ABAWD status
AGEi                      R       Age,AGEi,R       Age
CTZNi                     R       Citizenship status,CTZNi,R       Citizenship status
DISi                      C       Person-level disability indicator,DISi,C       Person-level disability indicator
DPCOSTi                   R       Reported dependent care cost,DPCOSTi,R       Reported dependent care cost
EMPRGi                    R       SNAP Employment and Training program status,EMPRGi,R       SNAP Employment and Training program status
EMPSTAi                   R       Employment status – type,EMPSTAi,R       Employment status – type
EMPSTBi                   R       Employment status – amount,EMPSTBi,R       Employment status – amount
FSAFILi                   R       SNAP case affiliation,FSAFILi,R       SNAP case affiliation
FSUNi                     C       Position of head of SNAP unit,FSUNi,C       Position of head of SNAP unit
NDISCAi                   C       Adult age 18 to 49 without disabilities in childless unit status,NDISCAi,C       Adult age 18 to 49 without disabilities in childless unit status
RACETHi                   R       Race/ethnicity,RACETHi,R       Race/ethnicity
RELi                      R       Relationship to head of household,RELi,R       Relationship to head of household
SEXi                      R       Sex,SEXi,R       Sex
WORKi                     C       Person-level working indicator,WORKi,C       Person-level working indicator
WRKREGi                   R       Work registration status,WRKREGi,R       Work registration status
YRSEDi                    R       Highest educational level completed,YRSEDi,R       Highest educational level completed
,,
Person-level countable income (monthly dollar amounts): i = 1 to 16,Person-level c,ountable income (monthly dollar amounts): i = 1 to 16
CONTi                     R       Countable income from contributions,CONTi,R       Countable income from contributions
CSUPRTi                   R       Countable child support payment income,CSUPRTi,R       Countable child support payment income
DEEMi                     R       Countable deemed income,DEEMi,R       Countable deemed income
DIVERi                    R       Countable State diversion payments,DIVERi,R       Countable State diversion payments
EDLOANi                   R       Countable income from educational grants and loans,EDLOANi,R       Countable income from educational grants and loans
EITCi                     R       Countable income from earned income tax credit,EITCi,R       Countable income from earned income tax credit
ENERGYi                   R       Countable energy assistance income,ENERGYi,R       Countable energy assistance income
FOSTERi                   R       Countable foster child income,FOSTERi,R       Countable foster child income
GAi                       R       Countable general assistance benefits,GAi,R       Countable general assistance benefits
OTHERNi                   R       Countable other earned income,OTHERNi,R       Countable other earned income
,,
,,
57,57,
V. CODEBOOK FOR THE FY 2017 SNAP QC DATABASE                        MATHEMATICA POLICY RESEARCH,V. CODEBOOK F,OR THE FY 2017 SNAP QC DATABASE                        MATHEMATICA POLICY RESEARCH
,,
,,
,,
VARIABLE              ORIGIN* DESCRIPTION                           Quick-Reference Codebook,VARIABLE,ORIGIN* DESCRIPTION                           Quick-Reference Codebook
,,
OTHGOVi                   R       Countable income from other government benefits,OTHGOVi,R       Countable income from other government benefits
OTHUNi                    R       Countable other unearned income,OTHUNi,R       Countable other unearned income
SLFEMPi                   R       Countable self-employment income,SLFEMPi,R       Countable self-employment income
SOCSECi                   R       Countable Social Security income,SOCSECi,R       Countable Social Security income
SSIi                      R       Countable SSI benefits,SSIi,R       Countable SSI benefits
TANFi                     R       Countable TANF payments,TANFi,R       Countable TANF payments
UNEMPi                    R       Countable unemployment compensation benefits,UNEMPi,R       Countable unemployment compensation benefits
VETi                      R       Countable veterans’ benefits,VETi,R       Countable veterans’ benefits
WAGESi                    R       Countable wages and salaries,WAGESi,R       Countable wages and salaries
WCOMPi                    R       Countable workers’ compensation benefits,WCOMPi,R       Countable workers’ compensation benefits
WGESUPi                   R       Countable wage supplementation income,WGESUPi,R       Countable wage supplementation income
,,
Detailed error findings: i = 1 to 9,Detailed error,findings: i = 1 to 9
AGENCYi                   R       Agency or client responsibility,AGENCYi,R       Agency or client responsibility
AMOUNTi                   R       Variance dollar amount,AMOUNTi,R       Variance dollar amount
DISCOVi                   R       Variance discovery,DISCOVi,R       Variance discovery
E_FINDGi                  R       Error finding,E_FINDGi,R       Error finding
ELEMENTi                  R       Variance element,ELEMENTi,R       Variance element
NATUREi                   R       Nature of variance,NATUREi,R       Nature of variance
OCCDATEi                  R       Variance occurrence date,OCCDATEi,R       Variance occurrence date
TIMEPERi                  R       Variance time period,TIMEPERi,R       Variance time period
VERIFi                    R       Variance verification,VERIFi,R       Variance verification
,,
,,
,,
,,
58,58,
V. CODEBOOK FOR THE FY 2017 SNAP QC DATABASE                          MATHEMATICA POLICY RESEARCH,V. CODEBOOK F,OR THE FY 2017 SNAP QC DATABASE                          MATHEMATICA POLICY RESEARCH
,,
,,
,,
VARIABLE             ORIGIN       DESCRIPTION                               Detailed Codebook,VARIABLE,ORIGIN       DESCRIPTION                               Detailed Codebook
Unit QC Review Administrative Data,Unit QC Review,Administrative Data
Unit QC review administrative data,Unit QC review,administrative data
ACTNTYPE                  R       TYPE OF ACTION,ACTNTYPE,R       TYPE OF ACTION
"Range = (1, 2)","Range = (1, 2)",
1 = Certification,1 = Certificat,ion
2 = Recertification,2 = Recertific,ation
,,
ALLADJ                    R       ALLOTMENT ADJUSTMENT,ALLADJ,R       ALLOTMENT ADJUSTMENT
"Range = (1, 3)","Range = (1, 3)",
1 = No adjustment,1 = No adjustm,ent
2 = Prorated benefit,2 = Prorated b,enefit
3 = Other adjustment,3 = Other adju,stment
,,
AMTADJ                    R       AMOUNT OF ALLOTMENT ADJUSTMENT,AMTADJ,R       AMOUNT OF ALLOTMENT ADJUSTMENT
"Range = (0, 1683)","Range = (0, 16",83)
,,
AUTHREP                   R       AUTHORIZED REPRESENTATIVE,AUTHREP,R       AUTHORIZED REPRESENTATIVE
"Range = (1, 2)","Range = (1, 2)",
1 = Used to make application,1 = Used to ma,ke application
2 = Not used to make application,2 = Not used t,o make application
,,
BENFIX                    C       BENEFIT ALLOTMENT ADJUSTED FOR ERRORS,BENFIX,C       BENEFIT ALLOTMENT ADJUSTED FOR ERRORS
"Range = (0, 2761)","Range = (0, 27",61)
,,
CASE                      R       CASE CLASSIFICATION,CASE,R       CASE CLASSIFICATION
"Range = (1, 3)","Range = (1, 3)",
1 = Included in error rate calculation,1 = Included i,n error rate calculation
2 = Excluded from error rate calculation – processed by SSA,2 = Excluded f,rom error rate calculation – processed by SSA
worker,worker,
"3 = Excluded from error rate calculation, as designated by FNS",3 = Excluded f,"rom error rate calculation, as designated by FNS"
